season,match_id,match_name,home_team,away_team,venue,city,country,current_innings,innings_id,name,fullName,runs,ballsFaced,minutes,fours,sixes,strikeRate,captain,isNotOut,runningScore,runningOver,shortText,commentary,link
2021.0,1254116,DC v KKR,DC,KKR,Sharjah Cricket Stadium,Sharjah,United Arab Emirates,DC,1,PP Shaw,Prithvi Shaw,18,12,17,2,1,150.00,False,False,"{'wickets': 1, 'runs': 32}",4.1,lbw b Varun,Shaw done in by one that skids back in to beat the inside edge. Shaw was looking to push it into the off side but played down the wrong line because he didn't pick the googly. Dhawan asked to get on his bike.,
2021.0,1254116,DC v KKR,DC,KKR,Sharjah Cricket Stadium,Sharjah,United Arab Emirates,DC,1,S Dhawan,Shikhar Dhawan,36,39,65,1,2,92.30,False,False,"{'wickets': 3, 'runs': 83}",14.1,c Shakib Al Hasan b Varun,"<strong>very good take by Shakib diving forward at backward point!</strong> Varun almost bowls that from back of the hand, and goes fullish and a touch wide of off. Dhawan is down the track early with the intention of slamming that away to the on side after also backing away a little, but his bottom hand is off, as the ball balloons after taking his outside edge",
2021.0,1254116,DC v KKR,DC,KKR,Sharjah Cricket Stadium,Sharjah,United Arab Emirates,DC,1,MP Stoinis,Marcus Stoinis,18,23,36,1,0,78.26,False,False,"{'wickets': 2, 'runs': 71}",11.3, b Shivam Mavi,"<strong>the leg stump is uprooted!</strong> Stoinis makes room to this back of a length ball on middle, which is angling after being bowled with a cross seam. But he gets a bottom edge as he looks to slash at that forcefully, and the ball crashes into leg stump. So Stoinis' comeback with the bat doesn't last long",
2021.0,1254116,DC v KKR,DC,KKR,Sharjah Cricket Stadium,Sharjah,United Arab Emirates,DC,1,SS Iyer,Shreyas Iyer,30,27,48,1,1,111.11,False,True,{},,not out,,
2021.0,1254116,DC v KKR,DC,KKR,Sharjah Cricket Stadium,Sharjah,United Arab Emirates,DC,1,RR Pant,Rishabh Pant,6,6,6,1,0,100.00,True,False,"{'wickets': 4, 'runs': 90}",15.2,c Tripathi b Ferguson,"<strong>bagged by mid-off, and Pant departs!</strong> Again Pant backs away, as Ferguson bowls back of a length outside off. Pant loses his bottom hand as he attempts to pull at that, but the ball seemed to have bounced more than he expected. The ball takes off from his top edge, and finds Tripathi, who has to take a few steps to his right to complete that catch",
2021.0,1254116,DC v KKR,DC,KKR,Sharjah Cricket Stadium,Sharjah,United Arab Emirates,DC,1,SO Hetmyer,Shimron Hetmyer,17,10,20,0,2,170.00,False,False,"{'wickets': 5, 'runs': 117}",18.3,run out (Iyer/&dagger;Karthik),"<strong>and Hetmyer is run-out!</strong> There was no run there, never! Iyer cuts this short delivery wide of off to Iyer at point, who throws bang to the keeper, who is close to the stumps to hammer the bails, with Hetmyer easily pretty short of his crease",
2021.0,1254116,DC v KKR,DC,KKR,Sharjah Cricket Stadium,Sharjah,United Arab Emirates,DC,1,AR Patel,Axar Patel,4,4,8,0,0,100.00,False,True,{},,not out,,
2021.0,1254116,DC v KKR,DC,KKR,Sharjah Cricket Stadium,Sharjah,United Arab Emirates,KKR,2,Shubman Gill,Shubman Gill,46,46,-,1,1,100.00,False,False,"{'wickets': 3, 'runs': 125}",16.4,c &dagger;Pant b Avesh Khan,"<strong>pocketed by Pant!</strong> Gill gets an outside edge to this full ball slightly wide of off, as he plays with a horizontal bat. The ball takes the top edge and takes off, as Pant leaps a little high and to his right, leaving the gloves open for the ball to arrive comfortably",
2021.0,1254116,DC v KKR,DC,KKR,Sharjah Cricket Stadium,Sharjah,United Arab Emirates,KKR,2,VR Iyer,Venkatesh Iyer,55,41,-,4,3,134.14,False,False,"{'wickets': 1, 'runs': 96}",12.2,c sub (SPD Smith) b Rabada,"<strong>nabbed at deep square leg!</strong> The sound off the bat first gave the impression that it was probably going all the way, but looked like it was timed far too well. He makes room and clears his front leg, as Rabada bowls shortish on middle and leg stump. Iyer pulled, but the ball landed right where the substitute fielder Smith was stationed",
2021.0,1254116,DC v KKR,DC,KKR,Sharjah Cricket Stadium,Sharjah,United Arab Emirates,KKR,2,N Rana,Nitish Rana,13,12,-,0,1,108.33,False,False,"{'wickets': 2, 'runs': 123}",15.6,c Hetmyer b Nortje,"<strong>short-arm pull, and taken at long leg!</strong> The ball takes off after pitching short outside off, as Rana pulls from deep in his crease and with his back leg outside off. He is not quite able to ride the bounce, as the ball comes off the higher side of the bat to fly to Hetmyer",
2021.0,1254116,DC v KKR,DC,KKR,Sharjah Cricket Stadium,Sharjah,United Arab Emirates,KKR,2,RA Tripathi,Rahul Tripathi,12,11,-,0,1,109.09,False,True,{},,not out,,
2021.0,1254116,DC v KKR,DC,KKR,Sharjah Cricket Stadium,Sharjah,United Arab Emirates,KKR,2,KD Karthik,Dinesh Karthik,0,3,-,0,0,0.00,False,False,"{'wickets': 4, 'runs': 126}",17.6, b Rabada,"<strong>the middle and off stumps are dislodged!</strong> Rabada bowls back of a length just outside off, and with seam up. Karthik looks to hoick that away to the on side, but gets an inside edge. There is life left in this game yet, as Capitals take it deep",
2021.0,1254116,DC v KKR,DC,KKR,Sharjah Cricket Stadium,Sharjah,United Arab Emirates,KKR,2,EJG Morgan,Eoin Morgan,0,3,-,0,0,0.00,True,False,"{'wickets': 5, 'runs': 129}",18.6, b Nortje,"<strong>chopped on!</strong> What is going on here? Another Knight Riders batter succumbs. This is a good length ball wide of off, which Morgan looks to hoick away, but gets a bottom edge on to his stumps, which are lit up after the ball lands there on the bounce. Nortje is all pumped up after that, as he leaves his side with a glimmer of hope in the final over",
2021.0,1254116,DC v KKR,DC,KKR,Sharjah Cricket Stadium,Sharjah,United Arab Emirates,KKR,2,Shakib Al Hasan,Shakib Al Hasan,0,2,-,0,0,0.00,False,False,"{'wickets': 6, 'runs': 130}",19.3,lbw b Ashwin,"walks across off trying to scoop, but the ball strikes his back pad! <b>Ashwin is up in a celebr-appeal, and it is given!</b> Oh my, where is this going? The ball was full on middle and off, and replays show the ball would have crashed into middle and off. Bang!",
2021.0,1254116,DC v KKR,DC,KKR,Sharjah Cricket Stadium,Sharjah,United Arab Emirates,KKR,2,SP Narine,Sunil Narine,0,1,-,0,0,0.00,False,False,"{'wickets': 7, 'runs': 130}",19.4,c Patel b Ashwin,"<strong>and taken at long-off!</strong> Damn! Ashwin gets two in two. <b>He is on a hat-trick</B>. But more than that, Capitals still remain afloat. He bowls with a wide-arm action, and goes full on off. Narine came down the track to try and clear the rope, but toe-ended the shot to lob that right where Axar sat",
2021.0,1254116,DC v KKR,DC,KKR,Sharjah Cricket Stadium,Sharjah,United Arab Emirates,KKR,2,LH Ferguson,Lockie Ferguson,0,0,-,0,0,-,False,True,{},,not out,,
2021.0,1254115,RCB v KKR,RCB,KKR,Sharjah Cricket Stadium,Sharjah,United Arab Emirates,RCB,1,D Padikkal,Devdutt Padikkal,21,18,26,2,0,116.66,False,False,"{'wickets': 1, 'runs': 49}",5.1, b Ferguson,"<B>chopped on!</b> Full and wide outside off from around the stumps. Padikkal sees the length and goes for the drive. But the ball has been inside-edged onto the stumps. A big fist pump from Lockie, and Padikkal walks back looking down",
2021.0,1254115,RCB v KKR,RCB,KKR,Sharjah Cricket Stadium,Sharjah,United Arab Emirates,RCB,1,V Kohli,Virat Kohli,39,33,59,5,0,118.18,True,False,"{'wickets': 3, 'runs': 88}",12.2, b Narine,"<B>how beautiful is that ball.</b> Full on middle. Kohli gets low to pay the slog sweep. But Narine delivers this slower through the air. Kohli goes for the slog sweep, but it goes under the bat and crashes into leg stump. Kohli gone after a strike-rate of under 120.",
2021.0,1254115,RCB v KKR,RCB,KKR,Sharjah Cricket Stadium,Sharjah,United Arab Emirates,RCB,1,KS Bharat,Srikar Bharat,9,16,20,0,0,56.25,False,False,"{'wickets': 2, 'runs': 69}",9.4,c Iyer b Narine,"full, wider outside off. Bharat finally goes for the big shot, but he doesn't have the power to get it over long off. Iyer runs around to get it, and Bharat falls after a 16-ball 9! The carrom ball turning away, and Narine gives out a tiny smile after the dismissal",
2021.0,1254115,RCB v KKR,RCB,KKR,Sharjah Cricket Stadium,Sharjah,United Arab Emirates,RCB,1,GJ Maxwell,Glenn Maxwell,15,18,33,1,0,83.33,False,False,"{'wickets': 5, 'runs': 112}",16.4,c Ferguson b Narine,"<B>there's the fourth!</b> Narine turning it on. Full on middle. Maxwell looks for the slog sweep. Sharp turn in, sliced in the air, and the ball is spiraling towards short third man. Ferguson under it",
2021.0,1254115,RCB v KKR,RCB,KKR,Sharjah Cricket Stadium,Sharjah,United Arab Emirates,RCB,1,AB de Villiers,AB de Villiers,11,9,9,1,0,122.22,False,False,"{'wickets': 4, 'runs': 102}",14.2, b Narine,"<B>another beauty!</b> Narine bowled Kohli. Narine bowled de Villiers. Big player has turned up on the big day. Its the flicker that he releases. Full on off. Slow in the air. de Villiers looks to defend, but there's a tiny gap between bat and pad. Turns in, goes through the space, and the bails have lit up once again!",
2021.0,1254115,RCB v KKR,RCB,KKR,Sharjah Cricket Stadium,Sharjah,United Arab Emirates,RCB,1,Shahbaz Ahmed,Shahbaz Ahmed,13,14,23,1,0,92.85,False,False,"{'wickets': 6, 'runs': 126}",18.6,c Shivam Mavi b Ferguson,"<strong>skies that to deep midwicket!</strong> A lowish full-toss on middle, and angling in. Shahbaz was standing outside leg, and went for the heave to the on side, but seemed to have got that from the bottom half of the bat. Mavi at the boundary remained unfazed by a team-mate of his running toward him from his right, and completed a calm take in the end",
2021.0,1254115,RCB v KKR,RCB,KKR,Sharjah Cricket Stadium,Sharjah,United Arab Emirates,RCB,1,DT Christian,Dan Christian,9,8,18,1,0,112.50,False,False,"{'wickets': 7, 'runs': 134}",19.4,run out (Ferguson/Shivam Mavi),"<b>run-out at the bowler's end!</B> Never run on a misfield they say, as Ferguson fumbles at square leg and the batters get involved in a mix-up in search of the second. But Christian was far too short when the throw came in after Harshal tried to scoop that full-toss wide of off, and was always ready to go for the second the moment he saw the misfield. There was a bit of a yes-no in the middle of the pitch, after which Harshal ran at the keeper's end, resulting in Christian falling short",
2021.0,1254115,RCB v KKR,RCB,KKR,Sharjah Cricket Stadium,Sharjah,United Arab Emirates,RCB,1,HV Patel,Harshal Patel,8,6,9,1,0,133.33,False,True,{},,not out,,
2021.0,1254115,RCB v KKR,RCB,KKR,Sharjah Cricket Stadium,Sharjah,United Arab Emirates,RCB,1,GHS Garton,George Garton,0,0,3,0,0,-,False,True,{},,not out,,
2021.0,1254115,RCB v KKR,RCB,KKR,Sharjah Cricket Stadium,Sharjah,United Arab Emirates,KKR,2,Shubman Gill,Shubman Gill,29,18,24,4,0,161.11,False,False,"{'wickets': 1, 'runs': 41}",5.2,c de Villiers b Patel,"<strong>sends that up milessss in the air, and de Villiers pouches it moving to his right from mid-on!</strong> Gill is foxed by the slower ball - an offcutter - which is full on middle, and looks to check his shot last moment. He makes room to try and send that into space, but ends up splicing it with his bottom hand off. That hung up in night sky for ages, before finally landing in de Villiers' hands to leave Kohli pumped",
2021.0,1254115,RCB v KKR,RCB,KKR,Sharjah Cricket Stadium,Sharjah,United Arab Emirates,KKR,2,VR Iyer,Venkatesh Iyer,26,30,51,0,1,86.66,False,False,"{'wickets': 3, 'runs': 79}",10.6,c &dagger;Bharat b Patel,"<strong>another short ball, and tickled behind to the keeper!</strong> That is 32 wickets for Harshal this season, and he ties with Bravo for most wickets in an IPL season. Iyer pulls at this short ball on middle - which is also a slower ball - but gets a touch of glove behind to the keeper, as Bharat dives to his right to grab at that",
2021.0,1254115,RCB v KKR,RCB,KKR,Sharjah Cricket Stadium,Sharjah,United Arab Emirates,KKR,2,RA Tripathi,Rahul Tripathi,6,5,10,1,0,120.00,False,False,"{'wickets': 2, 'runs': 53}",6.6,lbw b Chahal,"<strong>the googly now!</strong> Huge appeal for leg before, but not given. <B>Kohli reviews</B>. The ball strikes Tripathi's front pad as he looks to jab at that but is beaten. Hits him just above his knee after pitching on a good length outside off, and turning sharply into him. No inside edge is confirmed by UltraEdge. And replays show the ball would have taken the leg stump. So Tripathi departs, and Royal Challengers pinch one on the review",
2021.0,1254115,RCB v KKR,RCB,KKR,Sharjah Cricket Stadium,Sharjah,United Arab Emirates,KKR,2,N Rana,Nitish Rana,23,25,35,1,1,92.00,False,False,"{'wickets': 4, 'runs': 110}",14.2,c de Villiers b Chahal,"<B>taken at long on</b> and Chahal gets the wicket. Full on middle. Turning in. Rana goes for the slog sweep, but mistimed. In the air, but doesn't have the distance. Rana going for a poor-shot choice, giving RCB a sniff in",
2021.0,1254115,RCB v KKR,RCB,KKR,Sharjah Cricket Stadium,Sharjah,United Arab Emirates,KKR,2,SP Narine,Sunil Narine,26,15,31,0,3,173.33,False,False,"{'wickets': 5, 'runs': 125}",17.2, b Mohammed Siraj,"<strong>bowled him!</strong> Siraj leaps in the air, as he adds a touch of excitement to this. The off stump is pushed back, as Siraj bowls on a good length on off, and with a scrambled seam. Narine stands outside leg and prepares to slog that to the on side, but misses his heave. Some late drama here then?",
2021.0,1254115,RCB v KKR,RCB,KKR,Sharjah Cricket Stadium,Sharjah,United Arab Emirates,KKR,2,KD Karthik,Dinesh Karthik,10,12,20,1,0,83.33,False,False,"{'wickets': 6, 'runs': 126}",17.4,c &dagger;Bharat b Mohammed Siraj,"carried to Bharat? Yes, he thinks so. <b>Karthik has started walking back already though, but the umpire goes upstairs</B>. Good length ball outside off, and angling in. Karthik looks to half-cut-half-drive at that, but gets a faint outside edge off the bottom off the bat. The ball is dying to Bharat, who goes low to try and pouch that. Remember, there is no soft signal in IPL, so the call is to be entirely made by the third umpire. The TV umpire is not satisfied with the angles so far, and so we wait for more replays. Now he says he can see ""fingers underneath"", and Karthik has finally disappeared into the pavilion",
2021.0,1254115,RCB v KKR,RCB,KKR,Sharjah Cricket Stadium,Sharjah,United Arab Emirates,KKR,2,EJG Morgan,Eoin Morgan,5,7,16,0,0,71.42,True,True,{},,not out,,
2021.0,1254115,RCB v KKR,RCB,KKR,Sharjah Cricket Stadium,Sharjah,United Arab Emirates,KKR,2,Shakib Al Hasan,Shakib Al Hasan,9,6,10,1,0,150.00,False,True,{},,not out,,
2021.0,1254114,DC v CSK,DC,CSK,Dubai International Cricket Stadium,Dubai,United Arab Emirates,DC,1,PP Shaw,Prithvi Shaw,60,34,49,7,3,176.47,False,False,"{'wickets': 4, 'runs': 80}",10.2,c du Plessis b Jadeja,"<strong>lofted elegantly, but finds long-off!</strong> Looked like he checked his shot late, not entirely lofting his arms to play that aerially, as Jadeja pitched that full on off, and Shaw presented the full face of the bat. A dominant innings comes to an end",
2021.0,1254114,DC v CSK,DC,CSK,Dubai International Cricket Stadium,Dubai,United Arab Emirates,DC,1,S Dhawan,Shikhar Dhawan,7,7,17,1,0,100.00,False,False,"{'wickets': 1, 'runs': 36}",3.2,c &dagger;Dhoni b Hazlewood,"<B>the angle does the trick!</b> Full on middle, and angling across from Dhawan. He opens the bat's face to drive through the off side. Minimal footwork, ball moves away after pitching, and there's the edge. Four and out!",
2021.0,1254114,DC v CSK,DC,CSK,Dubai International Cricket Stadium,Dubai,United Arab Emirates,DC,1,SS Iyer,Shreyas Iyer,1,8,12,0,0,12.50,False,False,"{'wickets': 2, 'runs': 50}",5.3,c Gaikwad b Hazlewood,"<B>in the air</b> and taken by cover point running square to take it. Full on middle, angling into leg. Iyer looks to clip it away behind square leg for runs, but the <B>leading edge</b> took the ball in the other direction. That's two quick wickets",
2021.0,1254114,DC v CSK,DC,CSK,Dubai International Cricket Stadium,Dubai,United Arab Emirates,DC,1,AR Patel,Axar Patel,10,11,16,1,0,90.90,False,False,"{'wickets': 3, 'runs': 77}",9.4,c sub (MJ Santner) b Ali,<B>out or six? Taken by the sub</b> and Moeen wins this battle. Good length ball just outside off. Axar rocks back to flat-bat a shot over Moeen. But a bit of extra bounce and he ends up mistiming the shot. Santner (on the field for Hazlewood) makes no mistake running in from long on,
2021.0,1254114,DC v CSK,DC,CSK,Dubai International Cricket Stadium,Dubai,United Arab Emirates,DC,1,RR Pant,Rishabh Pant,51,35,55,3,2,145.71,True,True,{},,not out,,
2021.0,1254114,DC v CSK,DC,CSK,Dubai International Cricket Stadium,Dubai,United Arab Emirates,DC,1,SO Hetmyer,Shimron Hetmyer,37,24,44,3,1,154.16,False,False,"{'wickets': 5, 'runs': 163}",18.4,c Jadeja b Bravo,"<strong>taken at deep midwicket!</strong> This time Hetmyer finds the fielder right where he was positioned. He went for the pull to this short of a length ball just outside off, but the ball seemed to have bounced more than what Hetmyer expected, and the ball came off the higher side of the bat. A very good hand from Hetmyer comes to an end, although of course it would have been ideal for Capitals had he stayed till the end",
2021.0,1254114,DC v CSK,DC,CSK,Dubai International Cricket Stadium,Dubai,United Arab Emirates,DC,1,TK Curran,Tom Curran,0,1,7,0,0,0.00,False,True,{},,not out,,
2021.0,1254114,DC v CSK,DC,CSK,Dubai International Cricket Stadium,Dubai,United Arab Emirates,CSK,2,RD Gaikwad,Ruturaj Gaikwad,70,50,93,5,2,140.00,False,False,"{'wickets': 5, 'runs': 149}",18.1,c Patel b Avesh Khan,"<strong>Axar takes it nice and low on deep midwicket!</strong> Gaikwad went deep in his crease to hammer that low full-toss on off, but ended up getting it from the inside half of the bat. Axar had to run in forward, and then dive falling on his elbow",
2021.0,1254114,DC v CSK,DC,CSK,Dubai International Cricket Stadium,Dubai,United Arab Emirates,CSK,2,F du Plessis,Faf du Plessis,1,2,4,0,0,50.00,False,False,"{'wickets': 1, 'runs': 3}",0.4, b Nortje,"<B>pace does the job!</b> Crackin' delivery. Full ball, seam up. Lands on middle, and skids right through. du Plessis tries to flick across the line but the ball has zipped through the bat-body gap.",
2021.0,1254114,DC v CSK,DC,CSK,Dubai International Cricket Stadium,Dubai,United Arab Emirates,CSK,2,RV Uthappa,Robin Uthappa,63,44,62,7,2,143.18,False,False,"{'wickets': 2, 'runs': 113}",13.3,c Iyer b Curran,"<strong>smartly completed by Iyer at long-on after a bit of muddle there!</strong> Iyer remains composed as he is about to fall over across the rope and with Axar running across in front of him from deep midwicket. Iyer ultimately popped the ball back in the air while being forced by the momentum to go beyond the boundary, and came back in to finish it off cleanly in the end. Anyway, Uthappa looked to pull this shortish ball outside off, but seemed to have got that from the higher side of the bat. A commanding knock comes to an end",
2021.0,1254114,DC v CSK,DC,CSK,Dubai International Cricket Stadium,Dubai,United Arab Emirates,CSK,2,SN Thakur,Shardul Thakur,0,1,5,0,0,0.00,False,False,"{'wickets': 3, 'runs': 117}",13.6,c Iyer b Curran,"<strong>goes slogging, but that is taken by Iyer at long-on!</strong> A first-ball duck for Thakur, and the experiment doesn't come off. That was a back-of-a-hand slower ball from Curran, pitching pretty full and outside off. Thakur simply looked to swing his bat a touch away from his body, but sent that sailing to the man on the rope. Iyer in action again, but this catch is a lot simpler. Another blow for Super Kings",
2021.0,1254114,DC v CSK,DC,CSK,Dubai International Cricket Stadium,Dubai,United Arab Emirates,CSK,2,AT Rayudu,Ambati Rayudu,1,3,5,0,0,33.33,False,False,"{'wickets': 4, 'runs': 119}",14.4,run out (Iyer/Rabada),"<b>Iyer fires a throw to Rabada at the bowler's end, and Capitals now get Rayudu, who is run-out</b>. The bat was well short of the crease as Rabada clipped the bails, collecting the ball very close to the stumps, with the ball bouncing high after pitching just before him. It was a slower ball on a short of a length on off, and he pulled that over midwicket. Iyer at long-on rushed to his right, and launched that throw bang to the bowler. Some late drama here",
2021.0,1254114,DC v CSK,DC,CSK,Dubai International Cricket Stadium,Dubai,United Arab Emirates,CSK,2,MM Ali,Moeen Ali,16,12,27,2,0,133.33,False,False,"{'wickets': 6, 'runs': 160}",19.1,c Rabada b Curran,"<strong>pulls, but finds deep square leg!</strong> Another blow for Super Kings here. This was bowled short and on off, and Moeen seemed to have been beaten by the lack of pace, ballooning the ball right where Rabada was waiting. That is a wicket, and of course a dot ball to start the final over",
2021.0,1254114,DC v CSK,DC,CSK,Dubai International Cricket Stadium,Dubai,United Arab Emirates,CSK,2,MS Dhoni,MS Dhoni,18,6,11,3,1,300.00,True,True,{},,not out,,
2021.0,1254114,DC v CSK,DC,CSK,Dubai International Cricket Stadium,Dubai,United Arab Emirates,CSK,2,RA Jadeja,Ravindra Jadeja,0,0,5,0,0,-,False,True,{},,not out,,
2021.0,1254101,RCB v DC,RCB,DC,Dubai International Cricket Stadium,Dubai,United Arab Emirates,DC,1,PP Shaw,Prithvi Shaw,48,31,55,4,2,154.83,False,False,"{'wickets': 2, 'runs': 101}",11.2,c Garton b Chahal,"got him, Shaw falls two short of his fifty. A bit of loop here, brave bowling from Chahal, and Shaw was looking to hit over extra-cover. But the ball dips on him a little, and then turns, and he ends up slicing it squarer than intended, to the man at sweeper cover, who takes the ball on the third attempt while falling forward. It slipped out of his hands, but it hit his thighs rather than fall to the floor, and he managed to hold on thereafter. George Garton the fielder",
2021.0,1254101,RCB v DC,RCB,DC,Dubai International Cricket Stadium,Dubai,United Arab Emirates,DC,1,S Dhawan,Shikhar Dhawan,43,35,47,3,2,122.85,False,False,"{'wickets': 1, 'runs': 88}",10.1,c Christian b Patel,"slower ball, and that's the first wicket for RCB. Looks to make a bit of room, and Harshal follows him with his angle from around the wicket. Lots of revs on this offcutter, but it doesn't actually turn, just beats Dhawan for lack of pace. Looks to hit down the ground, and ends up spooning it high to mid-off",
2021.0,1254101,RCB v DC,RCB,DC,Dubai International Cricket Stadium,Dubai,United Arab Emirates,DC,1,RR Pant,Rishabh Pant,10,8,15,1,0,125.00,True,False,"{'wickets': 3, 'runs': 108}",12.4,c &dagger;Bharat b Christian,"extra bounce, and that gets Christian a big wicket. Back of a length, slanting across Pant, and he makes room to try and slap it away through point, but the ball rises and grabs his top edge through to the keeper",
2021.0,1254101,RCB v DC,RCB,DC,Dubai International Cricket Stadium,Dubai,United Arab Emirates,DC,1,SS Iyer,Shreyas Iyer,18,18,33,1,0,100.00,False,False,"{'wickets': 4, 'runs': 143}",17.4,c Christian b Mohammed Siraj,"<strong>holes out to long-on!</strong> Looks to loft that full-toss outside off, as Siraj bowls with a scrambled seam. Iyer is across off again to try and lift that, but gets that off the bottom of the bat to find the long-on fielder, who doesn't have to move a step",
2021.0,1254101,RCB v DC,RCB,DC,Dubai International Cricket Stadium,Dubai,United Arab Emirates,DC,1,SO Hetmyer,Shimron Hetmyer,29,22,41,2,2,131.81,False,False,"{'wickets': 5, 'runs': 164}",19.6,c Kohli b Mohammed Siraj,"<strong>finds deep midwicket!</strong> Kohli takes it a little late to his left though after he ran in a bit too much to his right. Siraj bowls a full-toss on middle, as Hetmyer looks to slog that, but gets that off the higher side of the bat",
2021.0,1254101,RCB v DC,RCB,DC,Dubai International Cricket Stadium,Dubai,United Arab Emirates,DC,1,RV Patel,Ripal Patel,7,7,17,1,0,100.00,False,True,{},,not out,,
2021.0,1254101,RCB v DC,RCB,DC,Dubai International Cricket Stadium,Dubai,United Arab Emirates,RCB,2,V Kohli,Virat Kohli,4,8,12,0,0,50.00,True,False,"{'wickets': 2, 'runs': 6}",2.1,c Rabada b Nortje,"<strong>ends up slicing to mid-on, who moves to his right to gobble that!</strong> Looks to launch the full delivery on middle at 146kph, as the bat turns in his hands while looking to go over the in-field. Another blow by Nortje, as Kohli seemed to have been beaten by pace, with the ball coming off the bottom of his bat",
2021.0,1254101,RCB v DC,RCB,DC,Dubai International Cricket Stadium,Dubai,United Arab Emirates,RCB,2,D Padikkal,Devdutt Padikkal,0,1,4,0,0,0.00,False,False,"{'wickets': 1, 'runs': 3}",0.5,c Ashwin b Nortje,"<strong>ramped right to third man!</strong> It is a short delivery on middle and off, which is angling away a touch. Padikkal lifts his bat very late - almost at the last moment before the ball would have left him - and ends up fending it to Ashwin, who takes it exactly where he is standing. Golden duck for Padikkal",
2021.0,1254101,RCB v DC,RCB,DC,Dubai International Cricket Stadium,Dubai,United Arab Emirates,RCB,2,KS Bharat,Srikar Bharat,78,52,88,3,4,150.00,False,True,{},,not out,,
2021.0,1254101,RCB v DC,RCB,DC,Dubai International Cricket Stadium,Dubai,United Arab Emirates,RCB,2,AB de Villiers,AB de Villiers,26,26,26,2,1,100.00,False,False,"{'wickets': 3, 'runs': 55}",9.3,c Iyer b AR Patel,"<strong>caught at deep square leg!</strong> Axar pitches it short on middle and leg, and the ball is quicker as well as coming on with the arm. de Villiers pulls, but sends that sailing to the man placed in the deep",
2021.0,1254101,RCB v DC,RCB,DC,Dubai International Cricket Stadium,Dubai,United Arab Emirates,RCB,2,GJ Maxwell,Glenn Maxwell,51,33,54,8,0,154.54,False,True,{},,not out,,
