season,match_id,match_name,home_team,away_team,venue,city,country,current_innings,innings_id,name,fullName,runs,ballsFaced,minutes,fours,sixes,strikeRate,captain,isNotOut,runningScore,runningOver,shortText,commentary,link
2021.0,1254075,RR v KKR,RR,KKR,"Wankhede Stadium, Mumbai",Mumbai,India,KKR,1,RA Tripathi,Rahul Tripathi,36,26,52,1,2,138.46,False,False,"{'wickets': 5, 'runs': 94}",15.2,c Parag b Mustafizur Rahman,"115.3ks, slower offcutter. Tripathi looks to take it on with a slog-sweep. But he only gets more height as opposed to distance. Dragged from a middle-stump line to Parag at deep midwicket",
2021.0,1254075,RR v KKR,RR,KKR,"Wankhede Stadium, Mumbai",Mumbai,India,KKR,1,SP Narine,Sunil Narine,6,7,9,1,0,85.71,False,False,"{'wickets': 3, 'runs': 54}",9.5,c Jaiswal b Unadkat,"After dropping one earlier in the evening, <strong>Jaiswal finds redemption</strong>. In-to-the-pitch offcutter, gets big on Narine. He top-edges a hook high in the air. Jaiswal tears in from long leg, dives forward and takes it with both hands, inches from the ground. Terrific work from Jaiswal",
2021.0,1254075,RR v KKR,RR,KKR,"Wankhede Stadium, Mumbai",Mumbai,India,KKR,1,EJG Morgan,Eoin Morgan,0,0,4,0,0,-,True,False,"{'wickets': 4, 'runs': 61}",10.2,run out (Morris),"pitched up on the stumps, driven ram-rod straight so much it hits the stumps at the non-striker's end. The ball gets deflected to Morris. Tripathi takes a few paces down the pitch, stops. Morgan responds and that results in a mix-up. Morgan then has to undo his steps, but before that Morris flicks it onto his stumps. Morgan has a wry smile on his face as he walks back for a duck without facing a ball. Replays indicate that the ball was deflected off Morgan's bat that was in the way. What an unfortunate way to go. That, by the way, is the first dot ball faced by Tripathi",
2021.0,1254075,RR v KKR,RR,KKR,"Wankhede Stadium, Mumbai",Mumbai,India,KKR,1,KD Karthik,Dinesh Karthik,25,24,42,4,0,104.16,False,False,"{'wickets': 7, 'runs': 118}",17.6,c Sakariya b Morris,"overpitched and outside off, Karthik throws his bat at ball and drills it in the air. Sakariya at extra-cover leaps and plucks it out of thin air. Karthik goes for 25 off 24 balls. He couldn't get going either on this used track. End of a double-wicket over from Morris",
2021.0,1254075,RR v KKR,RR,KKR,"Wankhede Stadium, Mumbai",Mumbai,India,KKR,1,AD Russell,Andre Russell,9,7,16,0,1,128.57,False,False,"{'wickets': 6, 'runs': 117}",17.4,c Miller b Morris,"another on-pace slot ball, but Russell picks out long-on. Pitched up and angling into off and middle, Russell sits back, swishes, and holes out to Miller at the edge of the boundary. Morris wins the match-up. This is the fourth time he has got Russell in T20 cricket",
2021.0,1254075,RR v KKR,RR,KKR,"Wankhede Stadium, Mumbai",Mumbai,India,KKR,1,PJ Cummins,Pat Cummins,10,6,11,0,1,166.66,False,False,"{'wickets': 8, 'runs': 133}",19.2,c Parag b Morris,"Holes out to deep midwicket. Another slower ball short and outside off. Hip-high delivery, pulled flat and hard to Parag. Sharp catch in the outfield",
2021.0,1254075,RR v KKR,RR,KKR,"Wankhede Stadium, Mumbai",Mumbai,India,KKR,1,Shivam Mavi,Shivam Mavi,5,7,10,1,0,71.42,False,False,"{'wickets': 9, 'runs': 133}",19.6, b Morris,"on-pace full-toss outside off, 139.4ks. Mavi shuffles across off and aims to scoop it over short fine leg. However, he just deflects it back onto his own stumps",
2021.0,1254075,RR v KKR,RR,KKR,"Wankhede Stadium, Mumbai",Mumbai,India,KKR,1,M Prasidh Krishna,Prasidh Krishna,0,0,3,0,0,-,False,True,{},,not out,,
2021.0,1254075,RR v KKR,RR,KKR,"Wankhede Stadium, Mumbai",Mumbai,India,RR,2,JC Buttler,Jos Buttler,5,7,21,1,0,71.42,False,False,"{'wickets': 1, 'runs': 21}",3.2,lbw b Varun,"<strong>Varun comes back to pin Buttler lbw</strong>. Quick fizzer from Varun again, fuller than the last ball, shaping into middle and rushes in to hit Buttler on his front pad in line with middle as he plays around it. It looks plumb. Buttler has a word with Jaiswal and then walks off, deciding against a review",
2021.0,1254075,RR v KKR,RR,KKR,"Wankhede Stadium, Mumbai",Mumbai,India,RR,2,YBK Jaiswal,Yashasvi Jaiswal,22,17,30,5,0,129.41,False,False,"{'wickets': 2, 'runs': 40}",4.5,c sub (KL Nagarkoti) b Shivam Mavi,<strong>Holes out to the sub fielder at sweep cover.</strong> Much fuller and angling across the left-hander. Jaiswal chucks his hands at the ball and slices it in the air to Nagarkoti,
2021.0,1254075,RR v KKR,RR,KKR,"Wankhede Stadium, Mumbai",Mumbai,India,RR,2,SV Samson,Sanju Samson,42,41,80,2,1,102.43,True,True,{},,not out,,
2021.0,1254075,RR v KKR,RR,KKR,"Wankhede Stadium, Mumbai",Mumbai,India,RR,2,S Dube,Shivam Dube,22,18,28,2,1,122.22,False,False,"{'wickets': 3, 'runs': 85}",10.5,c Prasidh Krishna b Varun,"<strong>Varun provides KKR with the breakthrough</strong>! Carved into the lap of short third man. Googly from Varun, he takes it away from the left-hander's swinging arc. Dube still dares to hoick it over midwicket. Instead, he slices it to Krishna",
2021.0,1254075,RR v KKR,RR,KKR,"Wankhede Stadium, Mumbai",Mumbai,India,RR,2,R Tewatia,Rahul Tewatia,5,8,14,0,0,62.50,False,False,"{'wickets': 4, 'runs': 100}",13.4,c sub (KL Nagarkoti) b Prasidh Krishna,<strong>Krishna bounces out Tewatia.</strong> Another chest-high short delivery cramps him on the pull. He can only top-edge it to Nagarkoti at long leg,
2021.0,1254075,RR v KKR,RR,KKR,"Wankhede Stadium, Mumbai",Mumbai,India,RR,2,DA Miller,David Miller,24,23,30,3,0,104.34,False,True,{},,not out,,
2021.0,1254074,PBKS v MI,PBKS,MI,"MA Chidambaram Stadium, Chepauk, Chennai",Chennai,India,MI,1,Q de Kock,Quinton de Kock,3,5,10,0,0,60.00,False,False,"{'wickets': 1, 'runs': 7}",1.6,c Henriques b Hooda,"<b>dragged straight to mid-on!</b> Length ball outside off, steps out and wants to slap it on the rise over that fielder. It sticks in the pitch and comes off the inside half and floats gently out to Henriques",
2021.0,1254074,PBKS v MI,PBKS,MI,"MA Chidambaram Stadium, Chepauk, Chennai",Chennai,India,MI,1,RG Sharma,Rohit Sharma,63,52,83,5,2,121.15,True,False,"{'wickets': 4, 'runs': 112}",17.3,c Allen b Mohammed Shami,"<b>whipped straight to deep square.</b> Low full toss at middle stump, gets low and whips this flat. There was a decent gap between deep square and fine leg, but he can't find it. A good knock from Rohit after the early struggles, but Punjab have stated this death overs phase very nicely. A sharp catch from Allen too, high to his right",
2021.0,1254074,PBKS v MI,PBKS,MI,"MA Chidambaram Stadium, Chepauk, Chennai",Chennai,India,MI,1,Ishan Kishan,Ishan Kishan,6,17,22,0,0,35.29,False,False,"{'wickets': 2, 'runs': 26}",6.6,c &dagger;Rahul b Ravi Bishnoi,"<b>caught behind!</b> Doesn't even wait for the umpire's decision. Kishan's horror form continues. This is a short of a length slider across off stump. He looks to cut and gets a thin edge, Rahul holds on well. Bishnoi strikes in his first over of the season",
2021.0,1254074,PBKS v MI,PBKS,MI,"MA Chidambaram Stadium, Chepauk, Chennai",Chennai,India,MI,1,SA Yadav,Suryakumar Yadav,33,27,45,3,1,122.22,False,False,"{'wickets': 3, 'runs': 105}",16.1,c Gayle b Ravi Bishnoi,"<b>taken at short third!</b> Legbreak, full and outside off. SKY switches up and looks to swing this reverse sweep over backward point. Gets a top edge and it hands up nicely for Gayle",
2021.0,1254074,PBKS v MI,PBKS,MI,"MA Chidambaram Stadium, Chepauk, Chennai",Chennai,India,MI,1,KA Pollard,Kieron Pollard,16,12,24,0,1,133.33,False,True,{},,not out,,
2021.0,1254074,PBKS v MI,PBKS,MI,"MA Chidambaram Stadium, Chepauk, Chennai",Chennai,India,MI,1,HH Pandya,Hardik Pandya,1,4,9,0,0,25.00,False,False,"{'wickets': 5, 'runs': 122}",18.4,c Hooda b Arshdeep Singh,"full and just outside off, might have been a slower ball. Hardik lines it up and looks to loft this over long-off. Difficult on this surface. Picks out Hooda",
2021.0,1254074,PBKS v MI,PBKS,MI,"MA Chidambaram Stadium, Chepauk, Chennai",Chennai,India,MI,1,KH Pandya,Krunal Pandya,3,3,8,0,0,100.00,False,False,"{'wickets': 6, 'runs': 130}",19.5,c Pooran b Mohammed Shami,"<b>oh superb work from Pooran at sweeper cover!</b> Slower ball, short and turning away outside off. Backs away and cuts aerially. Pooran tracks it to his left, keeps his eyes on it, and dives with the perfect timing to grab it before tumbling softly in his landing to keep it",
2021.0,1254074,PBKS v MI,PBKS,MI,"MA Chidambaram Stadium, Chepauk, Chennai",Chennai,India,MI,1,J Yadav,Jayant Yadav,0,0,2,0,0,-,False,True,{},,not out,,
2021.0,1254074,PBKS v MI,PBKS,MI,"MA Chidambaram Stadium, Chepauk, Chennai",Chennai,India,PBKS,2,KL Rahul,KL Rahul,60,52,85,3,3,115.38,True,True,{},,not out,,
2021.0,1254074,PBKS v MI,PBKS,MI,"MA Chidambaram Stadium, Chepauk, Chennai",Chennai,India,PBKS,2,MA Agarwal,Mayank Agarwal,25,20,36,4,1,125.00,False,False,"{'wickets': 1, 'runs': 53}",7.2,c SA Yadav b Chahar,"<b>half-hearted loft</B> finds long-on. Full delivery at leg stump, hurries into this attempted lofted drive over long-on, but he's not committed fully into it. Comes off the inside half and SKY takes it running forward and to his right. Mayank shadow practices a sweep as he walks off",
2021.0,1254074,PBKS v MI,PBKS,MI,"MA Chidambaram Stadium, Chepauk, Chennai",Chennai,India,PBKS,2,CH Gayle,Chris Gayle,43,35,51,5,2,122.85,False,True,{},,not out,,
2021.0,1254073,RCB v RR,RCB,RR,"Wankhede Stadium, Mumbai",Mumbai,India,RR,1,JC Buttler,Jos Buttler,8,8,12,2,0,100.00,False,False,"{'wickets': 1, 'runs': 14}",2.3, b Mohammed Siraj,"<b>hits the top of leg stump!</b> Buttler walks into the leg side and misses on this punch. Short of a length and slanted into leg stump. Not too different from the ball he hit through square leg last over, after walking into the off side. This time he's a long way down leg side with the stumps exposed and he misses the ball",
2021.0,1254073,RCB v RR,RCB,RR,"Wankhede Stadium, Mumbai",Mumbai,India,RR,1,M Vohra,Manan Vohra,7,9,20,1,0,77.77,False,False,"{'wickets': 2, 'runs': 16}",3.5,c Richardson b Jamieson,"<b>taken by mid-on running to the left!</b> Length ball outside off, Vohra wants to pump that over mid-on. He's not to the pitch of that and it gets big on him. It comes off the toe-end and Richardson tracks back to take that",
2021.0,1254073,RCB v RR,RCB,RR,"Wankhede Stadium, Mumbai",Mumbai,India,RR,1,SV Samson,Sanju Samson,21,18,31,2,1,116.66,True,False,"{'wickets': 4, 'runs': 43}",7.2,c Maxwell b Washington Sundar,"<b>chipped straight to midwicket!</b> That comes on slow and Samson can't keep it down. Short of a length, turning into the pads. Wants to whip that through vacant midwicket for a single. But that sticks and gets big on him and can only get that to Maxwell's left for a simple take",
2021.0,1254073,RCB v RR,RCB,RR,"Wankhede Stadium, Mumbai",Mumbai,India,RR,1,DA Miller,David Miller,0,2,7,0,0,0.00,False,False,"{'wickets': 3, 'runs': 18}",4.3,lbw b Mohammed Siraj,"<b>massive lbw appeal and Kohli reviews.</b> Miller is surprised by the yorker and looks to block it. It gets his bat and rolls out to mid-off, but did it hit his shoe first? It looks like it on first review...and the ball was vey full, it's likely to have pitched in line. <b>It has!</b> That decision will be overturned. A great review, and a great ball. Miller had no idea that was coming. Full and headed for middle and leg stump. Head falling over and foot planted right across the stumps. The move to bat him 4 hasn't worked",
2021.0,1254073,RCB v RR,RCB,RR,"Wankhede Stadium, Mumbai",Mumbai,India,RR,1,S Dube,Shivam Dube,46,32,58,5,2,143.75,False,False,"{'wickets': 6, 'runs': 133}",15.3,c Maxwell b Richardson,"<B>nicely taken by Maxwell running in.</b> Length ball at leg stump, creates room and has a slog at it, but it's off the toe-end. Dipping quickly as Maxwell runs to the left at long-on and he has to get low very quickly to take this inches off the ground with a lunge. Dube's played his best IPL knock, falls short of a fifty",
2021.0,1254073,RCB v RR,RCB,RR,"Wankhede Stadium, Mumbai",Mumbai,India,RR,1,R Parag,Riyan Parag,25,16,32,4,0,156.25,False,False,"{'wickets': 5, 'runs': 109}",13.3,c Chahal b Patel,"<b>looks to ramp over short fine, gets caught at third man.</b> Can't fault him for one thing - the ball was there for the ramp; But it's off the leading edge. Length ball outside off, drops into the off side to get behind it and manages it. But closes the face too soon. An annoyed Harshal shows him the way to the dugout",
2021.0,1254073,RCB v RR,RCB,RR,"Wankhede Stadium, Mumbai",Mumbai,India,RR,1,R Tewatia,Rahul Tewatia,40,23,30,4,2,173.91,False,False,"{'wickets': 7, 'runs': 170}",18.6,c Shahbaz Ahmed b Mohammed Siraj,"<b>picks out deep midwicket.</b> Slower short ball just outside off, gets a decent connection on it but there's no pace to play with. It's also the longer side. And he finds the man there",
2021.0,1254073,RCB v RR,RCB,RR,"Wankhede Stadium, Mumbai",Mumbai,India,RR,1,CH Morris,Chris Morris,10,7,21,0,1,142.85,False,False,"{'wickets': 8, 'runs': 170}",19.1,c Chahal b Patel,"<b>Morris groans as soon as he makes connection on this.</b> It's a full toss at off stump, he's walked across the stumps for the ramp. But he doesn't get low enough, ends up cramping himself, and can only dab this to short fine. RCB's new bowling finisher gets RCB's former bowling finisher",
2021.0,1254073,RCB v RR,RCB,RR,"Wankhede Stadium, Mumbai",Mumbai,India,RR,1,S Gopal,Shreyas Gopal,7,4,7,0,1,175.00,False,True,{},,not out,,
2021.0,1254073,RCB v RR,RCB,RR,"Wankhede Stadium, Mumbai",Mumbai,India,RR,1,C Sakariya,Chetan Sakariya,0,1,3,0,0,0.00,False,False,"{'wickets': 9, 'runs': 170}",19.2,c &dagger;de Villiers b Patel,"<b>AB settles under it, calls for it, takes it.</b> Slower ball at a length outside off, Sakariya gets under that and looks to slog. Gets it high but about as far as where short leg would be. AB takes a long sprint and takes it",
2021.0,1254073,RCB v RR,RCB,RR,"Wankhede Stadium, Mumbai",Mumbai,India,RR,1,Mustafizur Rahman,Mustafizur Rahman,0,0,3,0,0,-,False,True,{},,not out,,
2021.0,1254073,RCB v RR,RCB,RR,"Wankhede Stadium, Mumbai",Mumbai,India,RCB,2,V Kohli,Virat Kohli,72,47,74,6,3,153.19,True,True,{},,not out,,
2021.0,1254073,RCB v RR,RCB,RR,"Wankhede Stadium, Mumbai",Mumbai,India,RCB,2,D Padikkal,Devdutt Padikkal,101,52,74,11,6,194.23,False,True,{},,not out,,
2021.0,1254072,KKR v CSK,KKR,CSK,"Wankhede Stadium, Mumbai",Mumbai,India,CSK,1,RD Gaikwad,Ruturaj Gaikwad,64,42,59,6,4,152.38,False,False,"{'wickets': 1, 'runs': 115}",12.2,c Cummins b Varun,"<strong>hauled to deep midwicket, where Cummins takes it</strong>. He slog-sweeps it in the air, the outfielder runs in, slides on his knees, and snaffles it. Raina gives the outgoing Gaikwad a high-five. Pushed through outside off, Gaikwad gets hold of the slog, but can't clear Cummins",
2021.0,1254072,KKR v CSK,KKR,CSK,"Wankhede Stadium, Mumbai",Mumbai,India,CSK,1,F du Plessis,Faf du Plessis,95,60,105,9,4,158.33,False,True,{},,not out,,
2021.0,1254072,KKR v CSK,KKR,CSK,"Wankhede Stadium, Mumbai",Mumbai,India,CSK,1,MM Ali,Moeen Ali,25,12,25,2,2,208.33,False,False,"{'wickets': 2, 'runs': 165}",16.3,st &dagger;Karthik b Narine,"four, six, and out! Moeen ventures down the track and swings hard to the leg side again. Narine pulls his length back and brings this back into the left-hander. He misses, DK gathers it and takes the bails off. End of a charming cameo from Moeen",
2021.0,1254072,KKR v CSK,KKR,CSK,"Wankhede Stadium, Mumbai",Mumbai,India,CSK,1,MS Dhoni,MS Dhoni,17,8,18,2,1,212.50,True,False,"{'wickets': 3, 'runs': 201}",18.6,c Morgan b Russell,"scythed flat and hard. <strong>Morgan swoops to his left and pulls off an outstanding catch</strong>. Wide yorker from Russell, Dhoni reaches out for the ball, hits it hard, and holes out for 17 off 8 balls. 15 off the over, though",
2021.0,1254072,KKR v CSK,KKR,CSK,"Wankhede Stadium, Mumbai",Mumbai,India,CSK,1,RA Jadeja,Ravindra Jadeja,6,1,6,0,1,600.00,False,True,{},,not out,,
2021.0,1254072,KKR v CSK,KKR,CSK,"Wankhede Stadium, Mumbai",Mumbai,India,KKR,2,N Rana,Nitish Rana,9,12,15,2,0,75.00,False,False,"{'wickets': 2, 'runs': 17}",2.5,c &dagger;Dhoni b Chahar,"Ngidi runs in from long leg. Dhoni runs across to his left and settles under this skier near the square-leg region. He takes it after a brief stumble. This was on a length and swinging into the pads. Instead of putting it away to the fence, Rana skews it in the air off a leading edge and gives his wicket away",
2021.0,1254072,KKR v CSK,KKR,CSK,"Wankhede Stadium, Mumbai",Mumbai,India,KKR,2,Shubman Gill,Shubman Gill,0,1,4,0,0,0.00,False,False,"{'wickets': 1, 'runs': 1}",0.4,c Ngidi b Chahar,"<strong>slashed straight to deep third man</strong>. Short and wide of off, Gill chucks his hands at the ball and holes out to Ngidi who takes a couple of steps forward and snaffles it. Gill goes for a golden duck",
2021.0,1254072,KKR v CSK,KKR,CSK,"Wankhede Stadium, Mumbai",Mumbai,India,KKR,2,RA Tripathi,Rahul Tripathi,8,9,26,1,0,88.88,False,False,"{'wickets': 5, 'runs': 31}",5.2,c &dagger;Dhoni b Ngidi,<strong>KKR are five down and sinking</strong>. Banged in short and keeps coming back into Tripathi with the sharp angle from over the wicket. Too close to the body for the late cut/attempted ramp. Tripathi leans back and simply guides it into the gloves of Dhoni,
2021.0,1254072,KKR v CSK,KKR,CSK,"Wankhede Stadium, Mumbai",Mumbai,India,KKR,2,EJG Morgan,Eoin Morgan,7,7,10,1,0,100.00,True,False,"{'wickets': 3, 'runs': 27}",4.3,c &dagger;Dhoni b Chahar,"<strong>Chahar comes back and has Morgan nicking off.</strong> He celebrates it with a big roar. Nicely pitched up, angling away and swinging away outside off. Morgan flashes a drive and edges behind to Dhoni",
2021.0,1254072,KKR v CSK,KKR,CSK,"Wankhede Stadium, Mumbai",Mumbai,India,KKR,2,SP Narine,Sunil Narine,4,3,3,1,0,133.33,False,False,"{'wickets': 4, 'runs': 31}",4.6,c Jadeja b Chahar,"Jadeja springs into the action. He throws himself to his right from short cover and makes this catch look ridiculously easy.<strong> This why Chahar wants 11 Jadejas in the field</strong>. Chahar immediately drags his length back and adjusts his line. He targets the stumps, Narine makes some swinging room and slaps it to Jadeja",
2021.0,1254072,KKR v CSK,KKR,CSK,"Wankhede Stadium, Mumbai",Mumbai,India,KKR,2,KD Karthik,Dinesh Karthik,40,24,48,4,2,166.66,False,False,"{'wickets': 7, 'runs': 146}",14.6,lbw b Ngidi,"Ngidi is showcasing his variations. He traps DK lbw, the batter calls for a review. DK uses his feet, <strong>Ngidi slips in the big dipper</strong>. This is a low full-toss straight out of the Bravo playbook. Pings the back leg and this is crashing into leg stump. DK has to go",
2021.0,1254072,KKR v CSK,KKR,CSK,"Wankhede Stadium, Mumbai",Mumbai,India,KKR,2,AD Russell,Andre Russell,54,22,30,3,6,245.45,False,False,"{'wickets': 6, 'runs': 112}",11.2, b Curran,"<strong>Sam Curran: Makes things happen!</strong> Russell leaves it and gives Curran free access to his leg stump. Russell was thinking Curran would go full and wide like Thakur did last over. However, he hits a back of a length, Russell swerves outside off, doesn't offer a shot, and is castled. Or maybe Russell was thinking it would slant down the leg side. Anyway, smart stuff from Curran",
2021.0,1254072,KKR v CSK,KKR,CSK,"Wankhede Stadium, Mumbai",Mumbai,India,KKR,2,PJ Cummins,Pat Cummins,66,34,43,4,6,194.11,False,True,{},,not out,,
2021.0,1254072,KKR v CSK,KKR,CSK,"Wankhede Stadium, Mumbai",Mumbai,India,KKR,2,KL Nagarkoti,Kamlesh Nagarkoti,0,2,8,0,0,0.00,False,False,"{'wickets': 8, 'runs': 176}",16.2,c du Plessis b Ngidi,"<strong>The South African pair combine to get rid of Nagarkoti.</strong> Du Plessis dives forward and takes it. Back of a length on middle, Ngidi hits the hard length once again. The line is on middle. The bat-face turns on impact as Nagarkoti holes out for a duck",
2021.0,1254072,KKR v CSK,KKR,CSK,"Wankhede Stadium, Mumbai",Mumbai,India,KKR,2,CV Varun,Varun Chakravarthy,0,1,13,0,0,0.00,False,False,"{'wickets': 9, 'runs': 200}",18.3,run out (Chahar/Curran),"overpitched and outside off, belted straight of long-off. There's no second here, but <strong>Varun sacrifices his wicket to bring the big-hitting Cummins back on strike</strong>. Varun is caught short on the second. Nice, flat throw from Chahar",
2021.0,1254072,KKR v CSK,KKR,CSK,"Wankhede Stadium, Mumbai",Mumbai,India,KKR,2,M Prasidh Krishna,Prasidh Krishna,0,1,6,0,0,0.00,False,False,"{'wickets': 10, 'runs': 202}",19.1,run out (Chahar/Thakur),"Krishna is caught short on the second. <b>Another run-out from Chahar does it for CSK</b>. The TV umpire confirms it. Heartbreak for Cummins and KKR. Joy for CSK. Thakur searches for the wide yorker, comes out as a low full-toss. It's still a hard-to-hit low full-toss. Plinked down to long-off. Chahar runs across, swoops down on the ball, throws it to Thakur. The seamer holds his nerve, gathers the ball cleanly, and flips the bails off to catch Krishna short. Krishna stumbled on the first and wasn't quick enough in the end. <a href=""https://www.espncricinfo.com/series/ipl-2021-1249214/points-table-standings"" target=""_blank"">CSK jump to the top of the points table</a>",
2021.0,1254071,PBKS v SRH,PBKS,SRH,"MA Chidambaram Stadium, Chepauk, Chennai",Chennai,India,PBKS,1,KL Rahul,KL Rahul,4,6,14,0,0,66.66,True,False,"{'wickets': 1, 'runs': 15}",3.1,c Jadhav b Kumar,"<b>taken at short midwicket.</b> Short of a length delivery outside off, walks down at it and looks to launch that over midwicket. But he's had to really drag that, it stuck in the pitch. No pace on the shot and it's a simple grab for Jadhav to his left",
2021.0,1254071,PBKS v SRH,PBKS,SRH,"MA Chidambaram Stadium, Chepauk, Chennai",Chennai,India,PBKS,1,MA Agarwal,Mayank Agarwal,22,25,35,2,0,88.00,False,False,"{'wickets': 2, 'runs': 39}",6.6,c Rashid Khan b Ahmed,"<b>Rashid Khan takes one at midwicket</b> and that will be sent upstairs. It was dipping on him again, this time slowly and in front of him. He thinks it's out, but there wasn't a big celebration. The umpires have referred it and there is pretty straightforward evidence that he had his hands under that. Redeems himself, picks up the same batter. This was another slower ball, short of a length and across off stump. Looked to force a pull over midwicket but that just didn't come on. The pull floated slowly out to Rashid, who lunged forward",
2021.0,1254071,PBKS v SRH,PBKS,SRH,"MA Chidambaram Stadium, Chepauk, Chennai",Chennai,India,PBKS,1,CH Gayle,Chris Gayle,15,17,31,2,0,88.23,False,False,"{'wickets': 4, 'runs': 47}",8.4,lbw b Rashid Khan,"<b>he's struck right in front of middle and it's been given!</b> He won't review it. It was a legbreak and the fact he's struck in front of middle would suggest it's pitched in line. He got forward to defend, not sure which way it was turning. Bat and pad close together but he is beaten and he is gone",
2021.0,1254071,PBKS v SRH,PBKS,SRH,"MA Chidambaram Stadium, Chepauk, Chennai",Chennai,India,PBKS,1,N Pooran,Nicholas Pooran,0,0,3,0,0,-,False,False,"{'wickets': 3, 'runs': 39}",7.1,run out (Warner),"Pooran is in at 4 for the first time this season. And he might be run out without facing a ball! Short of a length offcutter, stabbed to Warner's right at extra cover. He takes off. Pooran seems like he doesn't want it - but we'll have to see the replay again. Because there's no other explanation for him being miles out as Warner hits the stumps with a once-bounce throw. The season hasn't gotten any better for Pooran. Can't say that the run wasn't there",
2021.0,1254071,PBKS v SRH,PBKS,SRH,"MA Chidambaram Stadium, Chepauk, Chennai",Chennai,India,PBKS,1,DJ Hooda,Deepak Hooda,13,11,19,2,0,118.18,False,False,"{'wickets': 5, 'runs': 63}",11.3,lbw b Abhishek Sharma,"<b>that looks plumb.</b> He's reviewed it after a chat with Moises, but this looks very very out. It's a length ball, pushed through quick, and he's caught on the back foot trying to shovel it fine. It's an arm ball. He's struck in front of leg stump. It needs to be sliding down leg for him to survive...<b>it is umpire's call.</b> That is out. A bit of a fade there for Hooda, He was happy to sweep and be on the front foot so far, completely misjudges this one",
2021.0,1254071,PBKS v SRH,PBKS,SRH,"MA Chidambaram Stadium, Chepauk, Chennai",Chennai,India,PBKS,1,MC Henriques,Moises Henriques,14,17,19,0,0,82.35,False,False,"{'wickets': 6, 'runs': 82}",13.4,st &dagger;Bairstow b Abhishek Sharma,"<b>stumped this time!</b> Beaten in flight, too far down the pitch to react. Middle stump ball, he was looking to go over cover, he was too far away from it and it spun past him. Lots of time for Bairstow to gather and complete the dismissal",
2021.0,1254071,PBKS v SRH,PBKS,SRH,"MA Chidambaram Stadium, Chepauk, Chennai",Chennai,India,PBKS,1,M Shahrukh Khan,Shahrukh Khan,22,17,33,0,2,129.41,False,False,"{'wickets': 8, 'runs': 110}",18.1,c Abhishek Sharma b Ahmed,"<b>picks out deep midwicket!</b> Slower ball at a length outside off, picks it up for the slog but there's no pace to work with. It floats out easily for the fielder there and Punjab lose out on two overs of Shahrukh, who was looking good",
2021.0,1254071,PBKS v SRH,PBKS,SRH,"MA Chidambaram Stadium, Chepauk, Chennai",Chennai,India,PBKS,1,FA Allen,Fabian Allen,6,11,15,0,0,54.54,False,False,"{'wickets': 7, 'runs': 101}",16.4,c Warner b Ahmed,"<b>taken at extra cover!</b> Warner flies to his right and completes the catch. Short of a length slower ball outside off, looks to force that punch off the back foot and ends up slicing it",
